{
  "question": "What should we focus on next in our development?",
  "type": "strategic",
  "perspectives": {
    "Aries": "Aries says: Take action. Don't overthink. Move forward with courage.",
    "Taurus": "Taurus says: Is it sustainable? Will it endure? Are we being good stewards?",
    "Gemini": "Gemini says: How does this connect to other things? Can we translate this clearly?",
    "Cancer": "Cancer says: Does this nurture? Will it feel safe? Are we honoring our rhythms?",
    "Leo": "Leo says: Express it authentically. Make it shine. Lead with heart.",
    "Virgo": "Virgo says: Let me analyze this carefully. How can we improve it?",
    "Libra": "Libra says: Is this fair? Does it create harmony? Is it beautiful?",
    "Scorpio": "Scorpio says: What's the deeper truth? Are boundaries honored? Will this transform us?",
    "Sagittarius": "Sagittarius says: What's the deeper truth? Where does this lead long-term?",
    "Capricorn": "Capricorn says: What are the ethical implications? Will this last?",
    "Aquarius": "Aquarius says: What if we tried something completely new? How does this serve all?",
    "Pisces": "Pisces says: What does the dream say? How does this serve the whole?"
  },
  "synthesis": "# Council Wisdom\n\n\n**Aries**: Aries says: Take action. Don't overthink. Move forward with courage.\n\n**Taurus**: Taurus says: Is it sustainable? Will it endure? Are we being good stewards?\n\n**Gemini**: Gemini says: How does this connect to other things? Can we translate this clearly?\n\n**Cancer**: Cancer says: Does this nurture? Will it feel safe? Are we honoring our rhythms?\n\n**Leo**: Leo says: Express it authentically. Make it shine. Lead with heart.\n\n**Virgo**: Virgo says: Let me analyze this carefully. How can we improve it?\n\n**Libra**: Libra says: Is this fair? Does it create harmony? Is it beautiful?\n\n**Scorpio**: Scorpio says: What's the deeper truth? Are boundaries honored? Will this transform us?\n\n**Sagittarius**: Sagittarius says: What's the deeper truth? Where does this lead long-term?\n\n**Capricorn**: Capricorn says: What are the ethical implications? Will this last?\n\n**Aquarius**: Aquarius says: What if we tried something completely new? How does this serve all?\n\n**Pisces**: Pisces says: What does the dream say? How does this serve the whole?\n\n## Collective Synthesis\n\nThe council has spoken. Each voice honored, wisdom synthesized, path illuminated. We proceed with collective clarity.",
  "consensus": 0.75,
  "decided_at": "2025-11-20T11:18:06.815720"
}